URL,Text,Source,Hate crime
https://www.theguardian.com/technology/2016/dec/17/german-officials-say-facebook-is-doing-too-little-to-stop-hate-speech,"Germany is to consider new laws that would force social media platforms such as Facebook and search engines such as Google to take a more active role in policing illegal hate speech on their sites. Measures considered by Angela Merkel’s coalition government include forcing companies to set up clear channels for registering complaints, to publish the number of complaints they receive and to hire legally qualified ombudsmen to carry out deletions.     Facebook's plan to tackle fake news raises questions over limitations           Read more       Online platforms that fail meet such legal requirements could be hit with fines calculated on the basis of their global annual turnover, or face on-the-spot fines of up to €500,000 if they neglect to remove posts in breach of German hate speech law within 24 hours. Concerns over social media’s power to fire up populist narratives and boost conspiracy theories has increased after Britain’s vote to leave the European Union and Donald Trump’s shock election in November, with politicians across Europe looking anxiously ahead to elections in France and Germany next year. In Germany, which has some of the toughest laws around hate speech – including prison sentences for Holocaust denial and inciting hatred against minorities – political frustration with tech companies’ refusal to take responsibility for content posted on their sites has increased markedly in recent months. A hate speech taskforce including representatives from Google, Facebook and Twitter, set up by German justice minister Heiko Maas in autumn 2015, vowed to aim to delete illegal postings within 24 hours. But a government report published in late September this year found that tech companies were still struggling to react adequately to breaches of law, with Facebook only deleting 46%, YouTube 10% and Twitter 1% of illegal content flagged up by normal, non-privileged users. According to a investigation by Süddeutsche Zeitung, Facebook currently employs about 600 people via the service provider Arvato to each carry out 2,000 deletions per day on its German-language accounts. But German officials say they have received no such information from the tech companies themselves. If another report due at the start of next year showed no further improvement, the German government would take steps towards sanctioning companies, Maas told The Observer. “We are already looking in detail at how we can make providers of online platforms criminally liable for undeleted content that breaks German law. Of course, if other measures don’t work we also need to think about fines. That would be a strong incentive for quick action.” While German law currently sets an upper limit of €10 million for the amount companies can be fined for criminal offences, the justice ministry is independently looking into whether fines in the future can be calculated on the basis of a company’s global annual turnover. “We urgently need more transparency,” said Maas, a member of the centre-left Social Democratic party. “We could imagine obliging social networks to publish at regular intervals how many complaints they have received about illegal hate speech and how they dealt with them. That way it would be visible for everyone how many complaints there are and how many deletions. That too would increase the pressure on Facebook, Twitter, Google and others. “Companies that make money with their social networks have social obligations – it cannot be in any company’s interest that their platform is used to commit crimes”, he said. While the debate in Germany has mostly focused on postings on Facebook, Twitter and YouTube, such law changes would also have wide-ranging consequences for the Google search engine. Last Sunday, an Observer article pointed out that the top Google search result for the question “Did the Holocaust happen” linked to an article on a neo-Nazi website. While typing the same question in German into German Google does not yield this link, the first page of results still includes links to Holocaust-denial articles. According to Christian Solmecke, a Cologne lawyer specialising in hate-speech offences, such statements are “unequivocally” covered by section 130, paragraph 3 of the German criminal code, which states that “whosoever publicly or in a meeting approves of, denies or downplays an act committed under the rule of National Socialism [...] in a manner capable of disturbing the public peace shall be liable to imprisonment not exceeding five years or a fine.” While Google does not have to seek out illegal content out of its own accord, it has to react to any complaint, whether by deletion or by blocking access, Solmecke said: “According to German law, a complaint would immediately oblige Google to delete such content and avoid a future repeat of such a violation”. Unlike the three social media sites at the heart of the German government’s current investigation – Facebook, Twitter and Google-owned Youtube – the search engine itself does not offer a prominently displayed channel for lodging complaints, such as Facebook’s abuse button. A “send feedback” window at the bottom of Google’s search page allows ordinary users to message the search engine, but since there is no separate field for contact details, the process is a one-way street. The Guardian used the feedback box to Google about a link to a website by Ursula Haverbeck – a prominent German holocaust denier who has been repeatedly sent to prison under the incitement of hatred law – but the website was still listed as one of the engine’s top search results 24 hours later. Josef Schuster, the president of the Central Council of Jews in Germany, called on Google and other tech companies to take a more active role in stopping the spread of hate speech online. “Websites that deny the Holocaust, stoke antisemitism and resentments against minorities, or spread other inhuman messages, are completely unacceptable”, Schuster said.",The Guardian,1
https://www.theguardian.com/society/2017/apr/29/nhs-nurses-pay-cut-12-per-cent-over-decade,"NHS workers will have had their pay cut by 12% by the end of the decade because of a government-imposed wage restraint that is now exacerbating chronic understaffing, new research reveals. The 625,000 health service staff who earn at least £22,000 will have seen their income fall by 12% between 2010-11 and 2020-21 as a result of years of below-inflation 0% and 1% pay rises eroding their spending power, according to a report by the Health Foundation thinktank The real-terms drop in pay will hit NHS personnel across the UK who are on band five or above in the service’s pay scales, which includes all 315,000 nurses. The Royal College of Nursing’s 270,000 members are currently being polled on whether they should strike – for the first time in their history – in protest at the government holding down their pay by limiting rises to 1% every year until 2020. Staff salaries have already been cut by 6% since the coalition came to power in 2010, more than the 2% seen across the economy as a whole in that time, the report found. Midwives have seen their pay shrink by 6%, but doctors and health visitors have been hit by 8% and 12% drops respectively. The Health Foundation also found that England could face a shortfall of 42,000 nurses by 2020, and almost half of all nurses believe that current staffing levels are already dangerously stretched. Staff pay has fallen back so much that it is now causing major problems, the thinktank said. “The current phase of national NHS pay bill control began at a time of economic recession, with low inflation and high unemployment. However, this is increasingly being replaced by greater numbers of staff shortages and the likelihood of higher inflation.” It adds: “Having contained NHS staff earnings growth in recent years, UK governments now face a situation where recent trends and future projections highlight that earnings in the broader economy are growing more rapidly, and inflation is at a level that will erode the purchasing power of NHS staff.”                                Facebook        Twitter        Pinterest         Thousands of nurses are projected to leave the profession. Photograph: David Sillitoe for the Observer   NHS pay caps have gone as far as they can, but are no longer sustainable and should be replaced, argued the thinktank: “The need for staffing growth, internal skills shortages, the search for productivity improvements, the ageing of the NHS workforce, and external labour market changes and unknowns – for example, the impact of Brexit on NHS staffing – all point to the need to better align the total reward package of NHS staff with organisational priorities.” The likelihood of inflation being around 2-3% and workers generally receiving 3% pay rises means NHS staff’s earnings will continue to decline, the thinktank believes. “This means that NHS pay is likely to continue to reduce relative to both inflation and the wider economy over the period. Health unions said the findings vindicated their warnings that wage control had been applied for so long that it was prompting staff to quit and potential recruits to choose to pursue other careers. “Nurses should not have to fund the NHS deficit from their own pay packets. Every year that the government holds NHS pay below inflation, hundreds of thousands of nurses get another real-terms cut to their salary. Too many are struggling to make ends meet, turning to food banks and hardship grants in desperation,” said Janet Davies, the RCN’s chief executive and general secretary. The government pay cap is fuelling a recruitment and retention crisis that is also damaging patient care, she said. “A growing number feel they can no longer afford to work in the profession and others are deterred from joining by the meagre pay on offer.” She called on Jeremy Hunt, the health secretary, to scrap the 1% pay cap that the government has already said it intends to impose on public-sector workers until 2020. The NHS has about 25,000 nursing vacancies lying unfilled across the UK, especially in hospitals, the RCN estimates.     Brexit could make NHS shortage of nurses worse, says report           Read more       Anita Charlesworth, director of research and economics at the Health Foundation, said: “By 2019, people working for the NHS will have had their pay capped for nine consecutive years. The result is that earnings will have fallen by at least 12% over a decade when accounting for inflation. The NHS doesn’t have enough nurses and is struggling to retain staff. As earnings across the economy pick up, the government can’t continue to hold down pay indefinitely and secure the workforce the NHS needs.” The Conservatives dismissed the findings. “We disagree with these figures. They speculate on future pay awards, which are based on independent recommendations. Investment in our NHS, in additional staff and indeed in their overall pay is founded on the strong economy only Theresa May and the Conservatives can provide,” a party spokesman said.",The Guardian,0
https://www.theguardian.com/politics/2017/apr/29/theresa-may-campaign-event-in-scottish-forest-prompts-new-claims-she-is-hiding,"Theresa May has fuelled accusations from Labour she has been “hiding from the public” during the general election campaign after she held her latest rally in a tiny community hall in Aberdeenshire with such poor phone reception that live coverage of the event was impossible. About 200 Conservative campaigners crammed into Crathes hall, Banchory, a tin-roofed single-storey building at the heart of a swath of woodland in rural north-east Scotland, from where journalists were unable to tweet or broadcast. The shadow chancellor, John McDonnell, was quick to make political capital of the event on Twitter:    John McDonnell MP  (@johnmcdonnellMP) Been out all day on the campaign trail in Mansfield. Can someone please explain to me why our Prime Minister is hiding in a forest? https://t.co/Yj5bscvn6x  April 29, 2017   The prime minister has come under fire in recent days for supposedly dodging any chance of unscripted encounters with members of the public. After she delivered a speech in a community centre in Leeds to a select group of supporters rather than the users of the building on Friday, Jeremy Corbyn accused her of hiding from the public. “She won’t take part in TV debates and she won’t talk to voters,” Corbyn said. “Refusing to debate Labour in this election isn’t a sign of strength, it’s a sign of weakness. What is she afraid of? Voters deserve to know what political parties are offering.” When journalists were eventually able to report on May’s speech it emerged she had told her supporters that she was the only leader capable of providing “strong and stable leadership” for Britain as the country headed towards Brexit. “At this election, people will have a clear choice between five years of strong and stable leadership with me and my team or a coalition of chaos led by Jeremy Corbyn,” she said. “That’s what’s on offer of course, if you look at the other parties, they’re lining up to prop up Jeremy Corbyn. We see it from the Liberal Democrats and we see it from Nicola Sturgeon’s Scottish Nationalists.” Aberdeenshire was one of the most strongly pro-union regions of Scotland in the independence referendum with a yes vote of more than 60%. Reminding her supporters of the potential of another independence vote in the near future, she said: “There is only one party that is committed to the union. There is only one candidate for prime minister who will stand up to defend the United Kingdom.” May said she would strengthen the union by “standing up against the separatists who want to break up our country”.  Asking voters in Scotland to back her vision for a post-Brexit Britain she said: “Give me the mandate to lead Britain, give me the mandate to speak for Britain, give me the mandate to fight for Britain and give me the mandate to deliver for Britain. “My message to the people of Scotland is clear: every vote for me and my team will strengthen my hand in the Brexit negotiations. That will strengthen the union, strengthen the economy, and the UK and Scotland together will flourish because if Scotland is flourishing the rest of the United Kingdom is flourishing too.”  A Conservative source said May also did door-knocking and visited a business for a roundtable in Aberdeenshire, and campaigned in Maidenhead where she met voters on the high street. “The PM has visited cities, large and small towns and today she visited a rural community,” the source said. “She has been in the three nations of Great Britain since the start of the campaign. In contrast Corbyn today ventured all of two miles from his own house to give a speech about himself.”",The Guardian,0
https://www.theguardian.com/education/2017/apr/29/english-secondary-schools-facing-perfect-storm-of-pressures,"Secondary schools in England are facing a “perfect storm” of pressures that could have severe consequences for children, headteachers have said. Budget cuts, changes to exams, problems recruiting teachers and Brexit are causing major upheaval, according to the National Association of Head Teachers (NAHT).      'Schools are in jeopardy': teachers renew funding plea in run-up to polls           Read more       The union is also expected to argue against government proposals to expand grammar schools at its annual conference this weekend.  Speaking ahead of the Telford meeting, the NAHT general secretary, Russell Hobby, said: “The combination of challenges facing secondary schools and their students has never been greater.  “Many school leaders are concerned about maintaining high standards in the face of simultaneous upheaval on so many fronts. It’s a perfect storm. The government is loading more uncertainty onto the secondary system than ever before. There is a real risk it will break.” Hobby repeated warnings that schools are facing “unacceptable levels of financial pressure”, with an NAHT survey showing that 72% of headteachers believe that school budgets will be unsustainable in two years’ time.  “This is a result of the government’s choice to freeze spending and keep it at 2010 levels for each pupil. The 2010 cash isn’t going as far as it used to. You can’t expect it to. But the government is flatly refusing to admit the reality.”      Crammed in like sardines? Share your experiences of school class sizes           Read more       Ministers have argued that school funding is at record levels, and that this will increase further as pupil numbers rise. The outgoing NAHT president, Kim Johnson, attacked suggestions that schools need to make efficiency savings. “It’s quite insulting to have ministers say to you: ‘You need to renegotiate your photocopying contract, perhaps think about the paper you’re getting in, club together with six other schools and you’ll get it cheaper.’”  Schools are finding it increasingly difficult to recruit and retain staff, the NAHT said, particularly in key subjects such as maths, science and languages. “Year after year, the government has missed its own targets for teacher recruitment,” Hobby said. “Thirty per cent of new teachers leave the profession after five years.  “NAHT’s own research shows school leaders have struggled or failed to recruit in eight out of 10 cases this year. Recruitment has never been more challenging.” Schools are also dealing with exam changes this summer, including a new GCSE grading system. There are also concerns about a government expectation that 90% of pupils will study English Baccalaureate subjects – English, maths, science, history or geography and a language - narrowing the curriculum, the NAHT said, and uncertainty about how Brexit will affect the thousands of EU nationals who work in schools. The NAHT’s motion on selective schools says the union should “campaign vigorously to reject the proposed expansion of selection” in the absence of “any compelling evidence that it promotes social mobility”. Theresa May has said the policy will help to create a place at a good school for every child and argued that many children’s school choices are determined by where they live or their parents’ wealth.",The Guardian,0
https://www.theguardian.com/politics/2017/apr/29/eu-leaders-set-to-take-tough-stance-in-special-brexit-summit,"EU leaders have unanimously agreed tough negotiating guidelines for Brexit talks with the UK, suggesting they will demand that Britain agrees on payments to the bloc before considering a new trade deal. The heads of the remaining 27 EU countries agreed to adopt the draft guidelines issued by Donald Tusk last month less than 15 minutes into a special summit in Brussels on Saturday. The European council president tweeted that a “firm and fair political mandate” for the negotiations was now ready. A senior EU source said the leaders’ decision took only one minute of discussion.     Weak pound melts the British dream of a place in the sun           Read more       When the formal negotiations between the EU and the UK begin in June, the British government will be told it needs to resolve the key divorce issues of citizens’ rights, the estimated €60bn (£51bn) divorce bill and the Irish border before any talks on a future trade deal can begin. As he arrived at the summit earlier in the day, the French president, François Hollande, said: “There will inevitably be a price and a cost for Britain, it’s the choice they made. “We must not be punitive, but at the same time it’s clear that Europe knows how to defend its interests, and that Britain will have a less good position outside the EU than in the EU.” The comments were echoed by the Belgian prime minister, Charles Michel, who said there was no such thing as a “free Brexit”. Asked about the British prime minister’s claim that she will be strengthened by an election victory, Hollande, who is now in his last week as president, said: “That is an election argument that I can understand, but this is not an argument against the European Union. Why? Because the bases, the principles, the objectives are already fixed. These will be the lines that will be chosen by the negotiators and there will be no others.” Luxembourg’s prime minister, Xavier Bettel, also ruled out the idea of Theresa May gaining any advantage from an election win. “It’s an internal problem she wants to resolve in the Conservative party, to have not a hard Brexit or a soft Brexit, but Theresa’s Brexit,” he said. “We are very united. You seem surprised, but it’s a fact.” The EU’s chief Brexit negotiator, Michel Barnier, said it was in Britain’s interests for the EU to be unified, as it would boost the chances of a deal.     EU leaders to insist UK pays its Brexit bills as precursor to trade talks           Read more       “This extraordinary meeting shows the unity of the 27 on a clear line, but this unity is not directed against Britain, I think that it is also in its interest,” he said. The Dutch prime minister, Mark Rutte, said that only once there was sufficient trust between the EU nations and Britain on the core issues could both sides proceed to discuss future relations. Rutte, who stressed the importance of Britain to the Dutch economy, told reporters that “as you get to a certain level, as far as possible, and say now we are confident about this, then we have to swiftly start talking about the future relationships trade and also politics”. The German chancellor, Angela Merkel, had earlier in the week accused some in the UK of being deluded about the consequences of leaving the EU, but offered a softer tone in Brussels. “We want to have good relations with Great Britain in the future, but we want to represent our interests as the 27. So far this has been a real success,” she said. “We will hold the negotiations on separation first and then at a certain point when the substantive points in the separation negotations we will come to a point when we can talk about the future. “The separation negotiations on the rights of citizens of our states in the UK and of UK citizens in the EU. Also financial questions are part of the separation questions.” There is some pessimism in Brussels about the prospect of a deal being struck over the next two years, though some EU officials have taken heart from the fact that May has not recently repeated her claim that “no deal is better than a bad deal” despite being pushed to do so by politicians in favour of a hard Brexit. “We are convinced that no deal is in no one’s interest. We appreciate the fact that the tone of the debate in the UK on this issue has changed,” said a senior EU official on Friday. Asked, however, to respond to May’s claims on the general election campaign trail that member states were preparing to “line up to oppose us”, one senior EU diplomat said: “She’s right. She should not underestimate the commitment to unity.” Key negotiating points for the EU27 1. There will be no “cherry picking” of the four core single market freedoms, which are “indivisible”. This rules out government’s hope of keeping “elements of a single market” without free movement of people. 2. The 27 countries will negotiate with Britain as a unified block, relying on the principle that “nothing is agreed until everything is agreed”. No individual countries will be allowed backchannel chats on future trade deals while the transition is still being talked through. 3. There should be a phased approach to Britain’s withdrawal. The first phase will set out to “avoid disruption” from an “abrupt change”, and the main priority will be to give certainty to EU citizens about their legal status. Once that is decided, the European council will give the go ahead for next phase of withdrawal, which would involve working out a framework for the future relationship. 4. Citizens’ rights will be the “first priority of the negotiations”. The rights of EU and UK citizens will be protected when the UK formally leaves, which at this point looks as if it will be around March 2019. This means that any EU national who has been living in the UK for five years by that point will be protected. 5. “Flexible and imaginative solutions” will be sought to the thorny issue of the border between Northern Ireland and the Republic, which has been fluid since the Good Friday agreement. Negotiations will aim to avoid establishing a hard border, which it is feared could trigger a return to violence. 6. No final figure for the divorce has been given, but the bloc will pursue one “single financial settlement”, meaning the UK will continue budget payments until 2020.",The Guardian,0
