URL,Text,Source,Hate crime
https://www.theguardian.com/politics/2017/apr/28/eu-leaders-to-insist-uk-pays-its-brexit-bills-as-precursor-to-trade-talks,"EU leaders will toughen their stance on Britain paying its Brexit bills when they agree negotiating guidelines at a special summit on Saturday. EU diplomats have agreed unanimously that Britain must settle its bills before embarking on trade talks. The position has been set out by EU leaders from the German chancellor, Angela Merkel, to the EU’s chief negotiator, Michel Barnier, but this will be the toughest statement yet from all 27 countries.     Tories’ ‘imperial vision’ for post-Brexit trade branded disruptive and deluded           Read more       “Member states are maximalist on the budget issue, because if Britain doesn’t pay, other member states will have to pay,” an EU diplomat said. Another senior diplomat said he had never seen net payers and recipients “working so closely with each other” in a wry allusion to the perennial tensions between countries that pay most into the EU budget and those that receive the biggest grants. The UK is due to make a net payment of around £20.4bn into the EU pot in 2019-20, in line with a promise David Cameron made in 2012 when he negotiated the EU’s seven-year budget. The European commission, however, believes the bill could come to as much as €60bn (£50bn) once the UK’s contribution to EU liabilities, pensions and special funds is taken into account. Barnier’s team will not present a bill on day one of the talks, but instead hopes to bind Britain to a set of principles on paying its dues, an approach broadly backed by Germany. EU leaders will not get into the specifics of money or the other two issues seen as essential parts of the divorce deal - citizens’ rights and the Irish border - on Saturday. They will focus discussions on what counts as sufficient progress for talks to start on trade. If they agree the UK has made progress on the divorce by the autumn, talks on a trade deal could start from early 2018.     Weak pound melts the British dream of a place in the sun           Read more       Separate to the EU’s negotiating guidelines, the leaders will discuss a text that would affirm Northern Ireland’s right to join the EU if the island were to unite. Diplomats stress that they do not expect Irish unification.  In a letter to EU leaders ahead of the summit, the president of the European council, Donald Tusk, reiterated that the bloc would stick to its timetable. “We will not discuss our future relations with the UK until we have achieved sufficient progress on the main issues relating to the UK’s withdrawal from the EU,” he said. “This is not only a matter of tactics, but - given the limited time frame we have to conclude the talks – it is the only possible approach.” EU leaders will also be briefed by Jean-Claude Juncker on his dinner with Theresa May at Downing Street earlier this week. Merkel was given the key points in an early morning phone call with the European commission president on Thursday. A few hours later she told German MPs that British politicians were still living under the illusion that the country could retain its rights and privileges after Brexit.     Britons could lose health cover in Europe after Brexit, report warns           Read more       EU sources have different views on the British government’s approach to Brexit. Some detect a new tone coming from London, with one senior diplomat talking of “much more realism on the negative consequences of no deal”. Others think London has not “engaged with reality”. One EU diplomat put the chances of the UK crashing out of the EU without a deal at higher than 50%. “They are not just on a different planet, they are in a different galaxy,” the diplomat said.  EU insiders are also uncertain about who Barnier will face across the negotiating table, whether it will be the Brexit minister, David Davis, or one of Theresa May’s top advisers. “I have no idea,” said one senior source.",The Guardian,0
https://www.theguardian.com/society/2017/apr/28/cancer-surgeon-convicted-of-performing-needless-breast-surgery,"The NHS has been forced to pay out almost £10m in compensation to more than 250 patients of a rogue surgeon found guilty of carrying out needless breast operations on patients who were left traumatised and scarred. Consultant surgeon Ian Stuart Paterson, 59, was convicted on Friday of 17 counts of wounding with intent, relating to nine women and one man. He was also convicted of three further wounding charges. Jurors at the seven-week trial at Nottingham crown court decided the surgeon carried out “extensive, life-changing operations for no medically justifiable reason” on the 10 patients between 1997 and 2011. He could have more than 1,000 additional victims, among them hundreds of private Spire Healthcare patients who may never be compensated for botched and unnecessary surgery.     Ian Paterson: the 'likable' breast surgeon who wounded his patients           Read more       Paterson, described in court by one victim as being “like God”, lied to patients and exaggerated or invented the risk of cancer to convince them to go under his knife. The jury at Nottingham crown court heard the surgeon, who saw hundreds of patients a year, carried out the operations for “obscure motives”, which may have included a desire to earn extra money. Paterson, wearing a black suit, blue shirt and red tie, sobbed as the jury returned the guilty verdicts. Judge Jeremy Baker released the surgeon on conditional bail ahead of sentencing in May, telling him he faced a custodial sentence. The maximum sentence for wounding with intent is life. One patient who gave evidence in the trial had 27 biopsy cores taken from her healthy right breast, which one expert told the court were random, and had “absolutely not” received medical best practice.  In tears, Frances Perks told the jury Patterson had conned her into thinking she was high risk and that he had destroyed her life. “He’s a psychopath. Why would anyone in their right mind do operations to people knowing that they didn’t need them?” she said, adding that she hoped he would rot in hell.  A number of Paterson’s former patients have died since being treated by him. Concerns were raised about his practice of carrying out so-called “cleavage-saving mastectomies”, which left behind tissue. This method meant that the chances of a relapse within five years doubled. One patient, Michelle Flavelle, died five years after Paterson treated her when her cancer spread to her liver, though it was not possible to establish a definitive connection.  Paterson denied misrepresenting patients’ test results to dupe insurers into paying for surgery, but other former patients have told the Guardian he exaggerated or invented the risk of cancer and, in some cases, claimed payments for more expensive procedures than those he had carried out. Ch Supt Mark Payne called Paterson a “controlling bully, who played God with people’s lives so he could live a luxurious lifestyle”. “The procedures carried out by Ian Paterson on vulnerable patients were unnecessary and caused physical suffering, scars and wounds to the patients,” he said. “Also, as a result of his greed and arrogance, many of the patients have suffered psychologically, believing they needed to undergo the procedures because they were at risk from breast cancer.”     There were no depths he wouldn't go to, says Ian Paterson surgery victim           Read more       Paterson was employed by the Heart of England NHS trust in 1998 despite having previously been suspended from Good Hope hospital in Sutton Coldfield, Birmingham. He also practised at Spire Healthcare hospitals in the Midlands over a 13-year period. The NHS has so far paid out around £18m including £9.5m in damages, settling 256 cases, with 25 outstanding, the Guardian has learned. Hundreds of Paterson’s private patients may never see a penny after his insurance company, the Medical Defence Union, said its cover was “discretionary” and had been withdrawn.  Paterson had a limited separate insurance policy of £10m, which solicitors say will not nearly cover the compensation and costs of all private patients. Another 350 people are still suing the NHS and Spire Healthcare over treatment in private hospitals where Paterson also practised. Spire Healthcare, which runs Parkway and Little Aston hospitals have settled some cases, but argue that as Paterson was not technically their employee, they are not responsible for his actions. The company would not divulge any details about the compensation paid. A Spire spokesman said: “What Mr Paterson did in our hospitals, in other private hospitals and in the NHS, absolutely should not have happened and today justice has been done. “We would like to reiterate how truly sorry we are for the distress experienced by any patients affected by this case. “We can say unequivocally that we have learned the lessons from these events. We commissioned a thorough independent investigation and have fully implemented all of the recommendations.” Sarah Jane Downing, who set up a petition demanding compensation for Paterson’s private victims, said she had been left “shocked and appalled” at the lack of redress.                                Facebook        Twitter        Pinterest         Sarah Jane Downing said Paterson’s private patients ‘bought into those promises in the glossy brochures’. Photograph: Teri Pengilley for the Guardian   “Many of these people chose private healthcare because they bought into those promises in the glossy brochures. And now we have realised that those promises are not worth the paper they are printed on. It’s utterly devastating,” she said. At a recent coffee morning for former Paterson patients, many described the consultant’s “brilliant” bedside manner. “He was so lovely, I thought I was so lucky. I thought I was being looked after,” said Elaine Diskin, whom Paterson operated on eight times in as many years. Her husband, Mike, also respected for the surgeonto the extent that when he had a pain in his chest, he went to Paterson and did not hesitate when he said he suspected lipoma and that they “had to get it out”. “Sinister was the word he used,” Mike Diskin said. “I had no reason to doubt him because he was looking after Elaine so well.” They trusted Paterson so much that they also recommended his care to a friend, who went on to have a lump removed. “We used to joke that we’d paid for his skiing holidays,” Elaine Diskin said. After the Diskins were recalled for a review of their treatment in 2012, they discovered that at least seven of the eight operations Paterson had performed on Elaine, along with those on her husband and their friend, were unnecessary. A civil case with seven test cases, which will determine to what extent Spire, the Heart of England NHS Trust and Paterson can be held liable, is scheduled to be heard in October, but looks likely to be delayed. The outcome will affect all the private patients who have brought civil claims and fear they may receive nothing. It is believed that Spire has made a handful of payments, the largest about £150,000, including for unnecessary removal of lumps and “cleavage-sparing mastectomies”, a controversial operation that left breast tissue behind after the removal of cancerous cells. Kashmir Uppal of Access Legal has worked with Paterson’s former patients since 2010. She said his actions had terrible consequences for her clients. “I am pleased that the jury have found him guilty and hope that this verdict will start the process of closure for his victims and early settlement of their civil claims,” she said.  “However, we now need a full public enquiry to ensure tighter regulation of patient care in the private sector, and to prevent this happening in the future.” Lesley Cuthbert, who did not feature in the trial but had a series of unnecessary operations carried out by Paterson, said she was “over the moon” about the outcome. “There is no forgiveness. What he has done will always be with us, but at least we can now start to move on.” Concerns about Paterson were raised as far back as 2003, but despite several internal and external investigations and complaints from patients, GPs and other surgeons, the General Medical Council did not suspend him until 2011. “In every profession you get rogue operators, but there are checks and balances to stop terrible things happening,” said Mike Diskin. “Why were there not in this case, or why were they ignored?” Timeline 1998: Paterson is hired as a consultant surgeon at the Heart of England NHS trust, despite being previously suspended from Good Hope hospital. He also sees private patients at Spire Healthcare hospitals of Little Aston and Parkway. 2003: He is investigated because of concerns about cleavage-sparing mastectomies. Recommendations are not followed through. 2007: Breast surgeon Hemant Ingle is appointed and with others raises concerns. Further investigations are carried out and Paterson is told to stop performing cleavage-sparing mastectomies. Mark Goldman, the chief executive of the Heart of England NHS trust, informs Spire that it is investigating Paterson. 2008: Two GPs complain about Paterson’s treatment of a patient, saying he gave misleading information about pathology reports, overtreated patients and disregarded the multidisciplinary team meeting process. Another report is also critical. 2009: A Spire Parkway patient makes a formal complaint about Paterson. No action is taken. Heart of England NHS trust recalls 12 patients who have had cleavage-sparing mastectomies. West Midlands Cancer Intelligence Unit submits two further reports. 2010: The GMC tells Spire Parkway executives about a complaint from an NHS patient.. 2011: Parkway are informed that Paterson carried out a cleavage-sparing mastectomy in 2009 after being told to stop in January 2008. A month later, the GMC informed Spire about another patient complaint. A recall of all Paterson’s patients begins. Paterson is suspended by the NHS in May 2011 but continues to perform breast surgery for Spire until 31 May and general surgery until 8 June 2011. He is paid until November 2012.",The Guardian,0
https://www.theguardian.com/technology/2017/apr/28/richard-browning-jet-powered-suit-iron-man-british-inventor,"Richard Browning, the British inventor dubbed “Wiltshire’s Iron Man”, successfully demonstrated his personal flight suit on the shores of Vancouver harbour, with mini jet engines on his hands. Inspired by the Marvel comic superhero Iron Man, Browning flew in a circle and hovered a short distance from the ground using thrusters attached to his arms and back, captivating attendees at the Vancouver TED conference. “The hypothesis was that the human mind and body, if properly augmented, could achieve some pretty cool stuff,” said Browning, an extreme athlete and engineer, at the gathering where he was representing his flight-suit startup company, Gravity. The personal flight suit, called Daedalus, is capable of propelling wearers much higher and faster than demonstrated on the day, according to Browning. He said he had experimented with various numbers and arrays of the engines on his limbs, with some more successful than others. The current suit is capable of flying for around 10 minutes.            Facebook        Twitter        Pinterest    A test flight of the Daedalus from early April.   “The whole journey was about trying and failing, and learning from that,” said Browning . “I don’t think anyone is going to be going down to Walmart with it or taking anybody to school for quite a while, but the team at his Gravity is moving it along.” A video of Browning’s first reasonably stable, six-second flight in Daedalus has logged more than million views since being posted on YouTube in March. The company has posted various videos showing flights and adjustments to the gear throughout the testing process. A flight suit that could carry a wearer from the beach along the coast and into a mid-air helicopter for further journeys are a while away, said Browning, but the firm has already received interest from investors including some from those in the British military. They told him they had given up on the flight feature of an Iron Man-style suit until seeing his human-propulsion gear.  The world’s first commercial jetpack will cost $150,000",The Guardian,0
https://www.theguardian.com/uk-news/2017/apr/28/westminster-terror-attack-suspect-named-khalid-mohammed-omar-ali,"The suspected terrorist arrested in Westminster carrying knives is a one-time humanitarian activist who is now facing questions from police about whether he was about to stage a murderous attack in central London. Khalid Mohamed Omar Ali, 27, was arrested by armed police on Thursday afternoon yards from the Houses of Parliament and the scene of the previous terrorist attack in March in which five people lost their lives. Counter-terrorism detectives continued questioning Ali on Friday. He had been under surveillance for weeks by MI5 and the Metropolitan police over concerns he had been lured by violent extremism. Ali was a schoolboy in inner north London who by the age of 21 had set sail on a ship to take relief supplies to Gaza on a mission that eschewed politics or religion but nonetheless became mired in difficulty and never reached its destination. Ali was being questioned at Southwark police station in south London, with detectives trying to piece together why he was in Westminster with two knives, what he intended to do with the implements and why. He is understood to have been a “lone actor”. Ali was born outside of Britain, moved to the UK at a young age and went to school in Tottenham, north London, a multicultural area that has a long history of neglect and where sections of the community mistrust the police and other authorities. In 2010 Ali joined the Road to Hope convoy taking aid to Gaza, sources have confirmed. He and other volunteers boarded the Strofades IV ship in Libya. The convoy leader, Kieran Turner, said it was apolitical. Turner said: “The people who were involved with this convoy were the ones who went to really do humanitarian care. “These were young men who were very keen to do something to help and for a lot of them it was a great introduction – some of them are still trustees on charities.” The voyage saw a falling out between the captain and those on board, and that part of the journey was aborted, with the vessel ending up in Greece with the humanitarian activists on board complaining of their treatment. Ali was last registered to an address in Enfield, north London, but is no longer resident there, according to official residence documents. His arrest followed counter-terrorism investigators tracking him as he traveled through London and armed officers were laying in wait and swooped on him in an area full of high-profile buildings such as the House of Parliament and Downing Street. He is alleged to have been carrying two knives in a bag that spilled out into the middle of the road as he was grabbed by police and put on the ground. Concerns about his behaviour were reported to police by at least one member of the Muslim community and led to a joint MI5 and Met police investigation.       Play Video           0:59           Armed police detain man near Houses of Parliament – video report   Ali was arrested at 2.22pm, police said, “on suspicion of possession of an offensive weapon and on suspicion of the commission, preparation and instigation of acts of terrorism. Knives have been recovered from him”. Police also said that they had carried out two searches at addresses in London as part of their inquiries into Ali. His arrest at junction of Parliament Street and Parliament Square was just yards from where Khalid Masood first drove into pedestrians on Westminster Bridge and then used a knife to stab a police officer to death. Investigators will be examining electronic devices seized during the searches and any computers or smartphones used by Ali to look for evidence of online material viewed and whom he was in contact with. Britain remains at a severe level of terrorism alert, meaning an attack is highly likely. Ali’s arrest was followed five hours later by arrests in Willesden, north west London. The Guardian understands investigators believe both operations thwarted terrorist attack plots that they fear may have been imminent. A source said of both had attracted “the very highest level of priority” from police and MI5. Despite their belief that two attack plans were disrupted within five hours of each other, at least two other suspected jihadist plots were on Friday being monitored and under investigation. Developments on Thursday were incorporated into a regular review of the alert status, but it was left unchanged. Met police counter-terrorism units and MI5 have been operating at an intense workload for two years with the rise of Islamic State and its call for attacks on the west, with 13 plots thwarted since 2013. Met police deputy assistant commissioner Neil Basu, senior national coordinator for counter-terrorism, said: “Activity continues around the clock to identify and stop these threats and we are making arrests on a near daily basis.”",The Guardian,0
https://www.theguardian.com/uk-news/2017/apr/28/man-charged-with-of-former-navy-officer-hit-with-own-car,"A man has been charged with murder in connection with the death of a former Royal Navy officer who was allegedly run over by thieves stealing his car. Mike Samwell, from Chorlton in Manchester who served in the navy for 12 years, died in the early hours of 23 April. Ryan Gibbons, also from Chorlton, has since been charged with murder, burglary and aggravated vehicle-taking. Greater Manchester police say the 29-year-old has been remanded in custody ready to appear before Manchester magistrates court on Saturday. The 35-year-old victim suffered fatal injuries after he is believed to have confronted thieves. The former navy engineer, whose wife Jess was home at the time, was taken to hospital for treatment but died a short time later. Police believe Samwell was run over at least once.  DI Lewis Hughes, of the force’s major incident team, said: “This has been a fast-moving investigation and we have made significant progress since Mike’s murder and have now arrested two more people, who will be questioned by detectives.” A 15-year-old boy was also arrested on suspicion of murder but there is no news as to whether he has also been charged. Two other men, aged 20 and 21, were arrested on suspicion of murder earlier this week but were bailed pending further inquiries. In a statement issued via GMP, Samwell’s family said his death “made a huge hole in our lives that can never be filled”.",The Guardian,0
