URL,Text,Source,Hate crime
https://www.theguardian.com/commentisfree/2017/apr/05/politics-antisemitism-gibraltar-brexit,"A young man wearing a top hat cuts a cigar with a red sickle. His nose is distended into a hook. He is surrounded by images of French politicians under the heading: “The truth about Macron’s galaxy.” It doesn’t take much fluency in racist propaganda to see what is going on: here is the liberal candidate in France’s presidential election as archetypal Jewish conspirator at the hub of global capitalism and communism. The cartoon was posted a few weeks ago from the official Twitter account of Les Républicains, the party of François Fillon, a conservative rival for the presidency. It was quickly deleted. Fillon apologised and said errant staff would be disciplined. The election caravan moved on to bigger scandals. Emmanuel Macron is Catholic but that doesn’t confer immunity from vintage antisemitism. He worked for Rothschild, the investment bank, which every Jew-spotting paranoiac knows is synonymous with Israelite global manipulation. In the early 1990s, when I was studying in Moscow, there was a conspiracy theory doing the rounds that Boris Yeltsin’s real name was Baruch Yeltzer. For militant Soviet nostalgists and neo-Nazis it was unthinkable that the man who broke the USSR, thus humiliating Russia, could be a true-blooded Russian. So they rebranded him as a Jew. The end of the cold war stoked enmities that had been tranquillised for decades. Russians made crushing rebellion in the Caucasus sound like unfinished business from the wars of Tsar Alexander I. In the Baltic states, politics was steeped in recrimination over who had collaborated with whom in the competition for control between Nazis and the Red Army 50 years earlier. There were fears of a spiral into expulsions, plunder and genocide, as had happened when Yugoslavia’s national scars split open.                                Facebook        Twitter        Pinterest         Emmanuel Macron shakes hands with his rival François Fillon before a televised debate. Photograph: Eliot Blondet/AFP/Getty Images   We tend to presume that history is formed at an even rate. If the passage of time is a constant, the past should always be getting further away. But it doesn’t work like that. At times of upheaval and disorientation, the past has a way of invading the present. When structures that looked immutable start to mutate, when political assumptions that were frozen solid begin to melt, forgotten layers of identity are revealed. The putrescent carcasses of buried conflicts are exposed, poisoning the air. The current crisis of confidence in western democracies does not equal the dissolution of the Eastern bloc. The European Union isn’t about to unravel as the Soviet Union did because, outside the lurid fantasies of Brexit provocateurs, the two entities are not alike. The EU is a collaborative project that respects human rights and political pluralism. The USSR was a one-party authoritarian superstate.     Europe in crisis? Despite everything, its citizens have never had it so good | Natalie Nougayrède           Read more       Yet the economic order that has prevailed without substantial challenge since the early 1990s looks brittle. Frustration at the impotence and self-absorption of a professional political class is epidemic. So is the perception that a financial elite has captured the proceeds of growth and that opportunities available to the next generation are more paltry than those enjoyed by their parents. The future of the west is shrouded in despondency – a feeling of epochal stagnation underscored by the relative dynamism of wrecker candidates preaching political sabotage. Perhaps collective inability to imagine what comes next is a factor reanimating the past. Or maybe at times of stress whole cultures, like individuals, fall back on gut reactions, fears and prejudices that rational cognition might overrule in calmer moments. Whatever the cause, there is something visceral and subliminal about the way politics across the west is fidgeting with anti-Jewish idioms. Whether intentional or not, there is antique spite lurking in the fashionable analysis that laments the excessive influence of “metropolitan elites” and “citizens of nowhere”. Soviet propaganda queried the patriotism of “rootless cosmopolitans”. When a Facebook army of the radical left rushes to defend Ken Livingstone from accusations of antisemitism, while depicting him as the victim of a campaign by “Zionists” or a shadowy “Israel lobby” that dictates the media’s script, it is worth pondering the etymology of that rhetoric. Nor has the normalisation of Islamophobia happened overnight. There are complex currents of anxiety arising from terrorist attacks in recent years and their conflation in public discourse with refugee flight from the Middle East and north Africa. But the deliberate misrepresentation by nationalists of an entire religion as a fifth column, harbouring who knows what level of murderous impulse, conjures a different spectre. Marine Le Pen in France and Geert Wilders in the Netherlands activate centuries-old reflexes of Christian recoil against the idea of encroaching Islam. When Brexit campaigners deployed posters suggesting Turks massing at the EU’s gates, they were probing dark recesses of the European psyche.                                Facebook        Twitter        Pinterest         Geert Wilders at the swearing-in of new members of parliament at the Hague. Photograph: Action Press/Rex/Shutterstock   In the grand scheme of continental history, the 1683 Ottoman siege of Vienna was not long ago. It isn’t much older than the 1707 Act of Union between England and Scotland, which is still pretty current in UK politics. And that was six years before the treaty of Utrecht in which Spain ceded sovereignty over Gibraltar. It is easy to dismiss the recent spasm of jingoism over the Rock as a silly ritual performed by a country that is jumpy ahead of tricky negotiations. But Brexit makes old agreements negotiable and that makes historical disputes more recent, which is a step towards making them dangerous. The more recently a conflict was frozen, the faster it defrosts. Taking evidence from Irish politicians, parliament’s Brexit select committee heard blunt testimony about the historical proximity of the Troubles. “The Good Friday agreement is … still a process and not a finished product,” notes the subsequent report. “If there are border posts and physical controls, they will become targets.” The blood stopped flowing recently enough that a botched EU deal can rip off the scab.     Northern Ireland's EU exit will destroy peace deal, says Gerry Adams           Read more       Maybe this sounds overwrought. We live in turbulent times but there are still boundaries to contain a surge in tribal European feuding and systematic racial scapegoating, aren’t there? I no longer know for sure. The sky is not falling. The ground beneath our feet is firm. But there is a whiff in the air, stale and sulphurous, as if rising from the soil after a thaw. It might pass. Or it might be the waking of dormant volcanoes.",The Guardian,1
https://www.theguardian.com/society/2017/apr/03/dangerous-attitudes-on-the-streets-of-croydon,"It’s all too easy to blame Brexit for last week’s horrific assault in Croydon (Report, 3 April) that has left a teenage Kurdish-Iranian asylum seeker fighting for his life, but problems in this London borough are more longstanding. In July 1992, Ruhullah Aramesh, an Afghan refugee living in the Thornton Heath area of the borough, was beaten to death in a racist attack by six white youths armed with iron bars and lumps of wood. Many other racist assaults occurred there during that decade. In 2011 a woman was filmed delivering a racist rant against black people and Poles on the Croydon tram. In January 2014 the English Defence League began targeting an Islamic community centre in Croydon as an “illegal mosque”. In June 2015 a woman had her hijab violently pulled off in a Croydon street. In October that year there was a high-profile immigration raid on Croydon works premises which resulted in seven arrests. Six of those arrested were transferred to detention centres pending their deportation. The immediate responsibility for the recent sickening attack lies with the perpetrators, but a share of responsibility surely also may lie with every media outlet, political organisation and government institution that has fuelled a toxic atmosphere against minorities and asylum seekers. And that includes the last home secretary, Theresa May, who sent her vans with anti-immigrant threats around the streets of areas such as Croydon until they were withdrawn. Even the local Tory MP, Gavin Barwell, welcomed their withdrawal.David RosenbergLondon • On behalf of Young Roots, I want to express how devastated I am about the attack on the young asylum seeker in Croydon on Friday. We are heartbroken by this brutal crime. Many young asylum seekers have fled war, torture and other atrocities. They have survived dangerous journeys here and face loneliness, worries about the rest of their family, and the challenge of navigating the complex immigration system. A large number have post-traumatic stress disorder. Yet the young people we work with in Croydon are a delight. They are bright, warm, friendly and so keen to learn. They are endlessly supportive and kind. Our thoughts are with the victim of this alleged hate crime, and we will continue to work hard to support the young refugee and asylum-seeking community in Croydon to be safe and come to terms with this terrible attack.Jo CobleyDirector, Young Roots – helping young refugees reach their potential • Join the debate – email guardian.letters@theguardian.com • Read more Guardian letters – click here to visit gu.com/letters",The Guardian,1
https://www.theguardian.com/uk-news/2017/apr/03/croydon-attack-comes-as-charities-report-growing-number-of-hate-crimes,"The attack on a teenage asylum seeker in Croydon last Friday comes as reports of abuse directed at refugee children are becoming more frequent, charities and experts have warned. As Reker Ahmed, the 17-year-old Kurdish Iranian who was attacked, recovered in hospital on Monday, those involved in supporting asylum-seeking children expressed dismay at the attack.     Toxic political agenda is dehumanising entire groups, Amnesty warns           Read more       Andy Elvin, chief executive of the fostering organisation Tact, which has looked after hundreds of asylum-seeking children across the country, said he was aware of a number of children in his organisation’s care who had been verbally abused in the streets, and he believed this was a growing problem. “It is verbal abuse – about their status, what they are doing in this country, why they don’t go back,” he said. The organisation runs support groups, advising newly arrived asylum seeking children on how to respond to negative experiences. It was particularly an issue which young people encountered on public transport, he said.  “We have made several reports to the police of hate crimes. We think it is rising. It is entirely linked to the environment that has been created by the public discourse about people coming to this country from overseas ... Asylum seekers are all seen as bogus – not as children, not traumatised, not in need, just freeloaders coming here to take advantage of the system.” Usually the abuse came as a complete surprise to the young people, Elvin added. “They didn’t expect to be targeted in this way. The perception of the UK abroad is still that it is a fair equitable country, where people are treated decently.”  Croydon currently has just over 400 unaccompanied child asylum seekers, a higher number than most local authorities, because it is the location of Lunar House, the government office where people must go to claim asylum.But a council spokesperson said: “This type of incident is extremely rare and our experience has been that the vast majority of young asylum seekers have been welcomed into the community.” Most of the younger child refugees in Croydon and elsewhere are accommodated by the council in foster families, and will go to school in the borough. The older ones, aged 16 or 17, are more likely to be found beds in supported accommodation, and may attend English classes, but will not be in school. Some councils provide acclimatisation sessions for newly arrived refugee children, educating them about British laws, the risks posed by drugs and their personal safety, but often the older arrivals are left largely unsupported to fend for themselves. Liz Clegg, who worked with child asylum seekers in Calais and is now helping child refugees to settle in the UK, said most were entirely unprepared for hostility. “They think: ‘Oh, now we’re in the UK, we’re completely safe.’ They have fled conflict zones and think they have arrived in the promised land; they have a very positive outlook. We have to educate them that there are still serious dangers, that they need to be careful for their personal safety.” Gulwali Passarlay, author of The Lightless Sky, an account of coming to the UK as a lone child asylum seeker from Afghanistan, said that attitudes towards refugees had hardened in recent months.  He highlighted the negative effect of the reporting of the arrival of child refugees from Calais last October (where the ages of the asylum seekers were questioned in some parts of the media), stoking cynicism about child refugees’ asylum claims, and dramatically souring a popular mood of support for child refugees that had followed the drowning of the three-year-old Syrian boy Alan Kurdi in 2015. “The environment has changed. People with rightwing views think it is OK to insult asylum seekers. There are a lot of good people in the UK but the mood is changing. Asylum seekers need to be cautious; it’s not always safe to walk around UK cities,” he said. Josie Naughton, co-founder of Help Refugees, said the attack demonstrated “the level of fear and prejudice which is taking hold of parts of British society”. Rabbi Janet Darley, who works with Citizens UK’s Safe Passage project, which supports unaccompanied asylum-seeking children, said: “This is a sobering reminder of the importance of the need to create a welcoming society, where refugees feel welcomed and accepted.” Donations to a crowd-funding site for the victim had reached over £10,000 by Monday afternoon. Bridie Watson, who launched the fundraising drive, had no personal contact with the victim, but was liaising with the police and social services to make sure the victim received the money. “It was so horrific. We wanted to help people put their shock and love into something positive. We want to show that this is not what the UK is about,” she said.",The Guardian,1
https://www.theguardian.com/us-news/2017/mar/27/new-york-stabbing-hate-crime-james-jackson-timothy-caughman,"A white suspect accused of the fatal stabbing of a black man on a Manhattan street has been indicted on a charge of murder as an act of terrorism. James Harris Jackson, 28, appeared briefly in court on Monday and did not speak. Prosecutors had previously also charged him with murder as a hate crime. Jackson’s attorney had no comment.     White veteran 'regarded fatal stabbing of black man as practice for larger attack'           Read more       Jackson is accused of killing Timothy Caughman, 66, a stranger to him. Caughman was attacked from behind last week as he was collecting bottles for recycling. An arraignment on the indictment has been set for 13 April. Speaking with a reporter for the Daily News at New York City’s Rikers Island jail complex, Jackson said he had intended it as “a practice run” in a mission to deter interracial relationships. He said he envisioned a white woman thinking: “Well, if that guy feels so strongly about it, maybe I shouldn’t do it.” Caughman, who was remembered as a gentleman and a good neighbor, was alone when he was attacked from behind with a sword. He staggered, bleeding, into a police station and later died at a hospital. “Tim Caughman did not deserve to die like that,” said Portia Clark, a childhood friend who grew up in Queens and attended the hearing with Caughman’s other friends on Monday. “Nobody does. I mean, come on, we’re black, white, yellow, brown – that’s ridiculous. We’re trying to get along.” Carl Nimmons wept outside court after seeing Jackson. “It really hurt me to see that man, because I can’t do nothing about it. I don’t have the power to do anything about it,” he said. In the Rikers interview, Jackson said in retrospect that he would rather have killed “a young thug” or “a successful older black man with blondes ... people you see in Midtown. These younger guys that put white girls on the wrong path”. He complained that on television, “it’s like every other commercial in the past few years has a mixed-race couple in it”. “The white race is being eroded ... No one cares about you. The Chinese don’t care about you, the blacks don’t care about you,” he said. Jackson, who was raised in what was described as a churchgoing, liberal family in a Baltimore suburb, said his ideal society was “1950s America”. Jackson was in the army from 2009 to 2012 and worked as an intelligence analyst, the army said. Deployed in Afghanistan in 2010 until 2011, he earned several medals and attained the rank of specialist. The military training, Jackson said, helped him plan the bloodshed. “I had been thinking about it for a long time, for the past couple of years,” he said. “I figured I would end up getting shot by police, kill myself, or end up in jail.” His attorney, Sam Talkin, has said if the allegations are anywhere close to being true, “then we’re going to address the obvious psychological issues that are present in this case”.",The Guardian,1
https://www.theguardian.com/us-news/2017/mar/24/new-york-hate-crime-stabbing-james-jackson-timothy-caughman,"A white military veteran accused of a hate crime for the stabbing death of a black man in New York regarded the attack as “practice” for a larger assault he hoped to carry out in Times Square, court documents claim. James Jackson, 26, was arrested hours after allegedly stabbing Timothy Caughman to death in Manhattan on Wednesday. According to prosecutors, Jackson, a Maryland resident, traveled to New York for his attack with the intention of killing “as many black men as possible”. “Mr Jackson regarded the killing as practice prior to going to Times Square to kill additional black men,” according to court documents obtained by the New York Daily News. Police investigators said Jackson admitted to the murder during questioning. Prosecutors said Jackson plunged a 2ft sword into the chest of Caughman, a self-described “can and bottle recycler”, as Caughman bent over a trash bin near his home. The 66-year-old, whose social media accounts are full of pictures with celebrities such as Beyoncé and Oprah, managed to stagger into a nearby police station, from which he was transported to a hospital and later died. “The defendant was motivated purely by hatred,” said the assistant district attorney Joan Illuzzi, who added that the charges could be upgraded, “as this was an act most likely of terrorism”. Prosecutors said Jackson hated black men, especially those who dated white women. According to investigators, Jackson, a decorated veteran of the Afghanistan war, had harbored his beliefs for at least a decade – at one point having been recorded on tape stalking black men. Dr Scott Krugman, chairman of pediatrics at Franklin Square medical center in Baltimore and a friend of the Jackson family, said the allegations were out of character with his family’s beliefs and the way he was raised. Jackson’s parents, David and Patricia Jackson, are active members of Towson Presbyterian church and have two other sons. Patricia Jackson is a former teacher of English-language students in the Baltimore County school system and worked for Well for the Journey, a Christian not-for-profit organization that helps people “integrate spirituality into their daily lives in a safe, inclusive space”. “They’re liberal as liberal can be,” Krugman said. “We were at a dinner party with them and everybody was complaining about the current administration and very open about rights for everybody and making sure we’re not excluding immigrants, everything like that. I’m just beyond shocked right now.” In a statement, the Jackson family extended condolences to Caughman’s family and said it was “shocked, horrified and heartbroken by this tragedy”.",The Guardian,1
https://www.theguardian.com/society/2017/mar/15/beware-jews-road-sign-north-london-reported-police,"A photographer and artist behind a red-triangle warning sign depicting the silhouette of an Orthodox Jewish man has apologised for causing offence after a Jewish neighbourhood watch group reported it as a hate crime. Franck Allais, a freelance photographer, said the contentious sign was part of an artistic project, which includes depictions of a woman pulling a shopping trolley, a man pushing his wheelchair and a cat. Allais said he intended the project to be a comment on identity and that the sign in Stamford Hill, one of the largest Hasidic communities in Europe, was not an antisemitic statement. He said he was left shaken by the offence he had caused. He said: “It was a project about crossing the road … how everyone is different, everyone has an identity. There is not only one sign in the street. I put more signs up in the street, but only this one got noticed. I am sorry for any offence caused.” Shomrim, a Jewish neighbourhood watch group that reported the sign to the Metropolitan police and Hackney council, said earlier it had caused “alarm and distress to local people”. Stamford Hill is at the centre of an ultra-Orthodox Jewish and mainly Hasidic community estimated to number about 30,000 people. Barry Bard, Shomrim’s operational supervisor in the area, said: “The people of Stamford Hill are very sadly used to instances of antisemitic hate crime, but most of those times it will be verbal abuse or even assault. A lot of the time it will be more of a person-to-person kind of thing, or graffiti, which is more unprofessional.” Allais, who has done work for Guardian Weekend, the Saturday and Sunday Telegraph, FT Weekend magazine, the Independent on Sunday, Newsweek and Time Out, said he had created the signs based on real people he saw crossing the road in the areas where the signs were later hung and photographed. Some of the other signs have since been spotted.    Jonathan Savage  (@JSavageTweets) Here's one of the other signs - put up in Egerton Road N16 pic.twitter.com/cnUcs12Xp9  March 15, 2017   Hackney council was expected to remove the Stamford Hill sign on Wednesday. The number of antisemitic incidents in the UK rose by more than a third to record levels in 2016, according to data released by the Community Security Trust. The CST, which monitors antisemitism and provides security to Jewish communities, recorded 1,309 incidents of anti-Jewish hate last year, compared with 960 in 2015, a rise of 36%. The previous peak was in 2014, when 1,182 incidents were recorded.",The Guardian,1
