URL,Text,Source,Hate crime
https://www.nytimes.com/2017/04/26/opinion/after-hate-crimes-victims-stuck-with-the-bill.html,"This Week in Hate highlights hate crimes and harassment around the country since the election of President Trump. Kanwal Khurana loved living in Cleveland. He and his wife had moved from the suburbs to an apartment in the city in December. “It’s beautiful,” he said. “You can see the whole downtown.” But less than two months later, Mr. Khurana and his wife had just parked their car across the street from the building when they heard someone say, “go back to your own country.” The next morning, they discovered that someone had slashed all four of their tires. Mr. Khurana, 63, is retired from his job writing contracts for Cuyahoga County, and his wife is a homemaker. They help their son pay his tuition at Kent State. They have car insurance, but still had to come up with a $500 co-payment to have their car towed and repaired, plus the fee to rent a car in the meantime. The Khuranas reached out to city and state officials for help paying their bills. They discovered, as many victims of hate and harassment do, that getting financial assistance isn’t always easy. Victims of hate crimes can sue perpetrators under state and federal hate crime or other civil rights laws for compensatory damages and, in some cases, punitive damages as well. But first they need lawyers. The Lawyers’ Committee for Civil Rights Under Law recently began operating a hotline at 844-9-NO-HATE (844-966-4283), through which volunteers can help callers find legal representation. But beyond that, “there is no real comprehensive network around the country” to connect victims of hate crimes or harassment with lawyers, said Betsy Shuman-Moore, the director of the Hate Crime Project at the Chicago Lawyers’ Committee for Civil Rights. In the Chicago area, she added, legal resources for hate crime victims have actually decreased in recent years. When the perpetrator remains unidentified, as in the Khuranas’ case, a lawsuit is usually not an option. Some states, however, have funds set aside to help crime victims pay their expenses. Mr. Khurana wrote to the mayor of Cleveland, whose staff suggested he contact the Ohio attorney general’s office. The office maintains a victims’ compensation fund, but Mr. Khurana was told he was not eligible for compensation because he had not been physically injured. The office sent him a booklet titled “Picking Up the Pieces” with information about crime victims’ rights. Sometimes, friends or family — or strangers — step in to help hate crime victims. After Cristina Alfonso-Zea was attacked last year in the parking lot outside her home in Las Vegas by assailants who hit her in the head, stole her wallet and phone and wrote slurs on her car, her friend set up a GoFundMe campaign to help her. Ms. Alfonso-Zea, a veteran, already had post-traumatic stress disorder, which was exacerbated by the attack. The money from the campaign helped her fix her car and move away from the area where she was attacked. The campaign also helped her psychologically, she said: “It made me realize that there’s really good people out there that really care about you, even if they don’t know you.” She wishes hate crime victims got more information on compensation funds and other resources. “In Las Vegas, they teach us about flash flooding, they teach us abandonment of a rabbit is a felony,” she said, “but at the same time they don’t really teach us about having funds like that or having a safe place that you can go to.” Mrs. Khurana ultimately sold some of her jewelry to pay for their car expenses. The Khuranas don’t plan to move, but they are more careful when they go out in their neighborhood now, and they park their car in a different spot that costs $5 a day. Mr. Khurana is grateful he and his wife weren’t hurt — he thinks of the shooting of two Indian immigrants, Srinivas Kuchibhotla and Alok Madasani, in Kansas in February. “That night anything could have happened,” he said. “We still feel lucky.” If you have experienced, witnessed or read about a hate crime or incident of bias or harassment, you can use this form to send information about the incident to This Week in Hate and other partners in the Documenting Hate project. The form is not a report to law enforcement or any government agency. These resources may be helpful for people who have experienced harassment. If you witness harassment, here are some tips for responding. You can contact This Week in Hate at weekinhate@nytimes.com. ",New York Times,1
https://www.nytimes.com/2017/04/21/world/europe/chechnya-russia-attacks-gays.html,"GROZNY, Russia — It was supposed to be a night out. But for the young man who calls himself Maksim, as for scores of other gay men arrested in a pogrom this month in Russia’s Chechnya region, it pivoted into nearly two weeks of beatings and torture. Maksim said it had started with a chat room conversation with “a very good old friend who is also gay,” and who suggested that they meet at an apartment. When Maksim arrived, however, he was greeted not by his friend but by agents who beat him. Later, they strapped him to a chair, attached electrical wires to his hands with alligator clips and began an interrogation. “They yelled, ‘Who else do you know?’” Maksim said, and zapped him with current from time to time. “It was unbearably painful; I was hanging on with my last strength,” he added. “But I didn’t tell them anything.” Gay men have never had an easy life in Chechnya. But the targeted, collective punishment of gays that began last month under its pro-Kremlin leader, Ramzan A. Kadyrov, is a new turn in the region’s long history of rights abuses. Novaya Gazeta, an opposition newspaper, first reported the pogrom, saying that at least 100 gay men had been arrested and three killed in the roundup. Human Rights Watch corroborated those findings. The sweep has been widely condemned by Western governments, the United Nations and rights groups. Activists in Russia have set up an underground network to spirit the victims out of Chechnya and to protect them from potentially violent reprisals from their families and others. The victims use assumed names in their everyday dealings. The following account is based on interviews with Maksim, who is in his 20s, and two other gay men who were detained by Chechen security agents. Homosexuality is taboo in Chechnya and the mostly Muslim surrounding areas of the Caucasus region in southern Russia. “This society is highly homophobic,” said Ekaterina L. Sokiryanskaya, Russia project director for the International Crisis Group and an authority on Chechnya. “Homosexuality is condemned. It is believed Islam considers it a great sin.” Nevertheless, before the crackdown, gay men in Chechnya could at least lead social lives, if heavily closeted ones, Maksim said. They met largely in private chat rooms on social networking sites with names like the Village or What the Mountains Are Silent About. “When two gay men meet, they don’t tell one another their true names,” Maksim said. Men met at cafes or at apartments rented for a night, he said. “Nobody suspected my sexual orientation, not even my best friends.” The crackdown began after GayRussia, a rights group based in Moscow, applied for permits for gay pride parades in the Caucasus region, prompting counterprotests by religious groups, the men said. In Chechnya, it became something even worse — a mass “prophylactic” cleansing of homosexuals, the security service agents told the gay men as they rounded them up. The men were held for as little as a day or as long as several weeks, according to Human Rights Watch and to interviews with gay men who later escaped the region. Some “returned to their families barely alive from beatings,” said Tanya Lokshina, Russia program director for Human Rights Watch. Among the fatalities documented by the organization were one man who succumbed during torture and two others who died in “honor killings” by relatives after the police released them. “Human Rights Watch has been getting numerous reports about attacks by security services under Ramzan Kadyrov’s control, and those reports are extremely disturbing,” Ms. Lokshina said. “This is another opportunity to reinforce the culture of fear.” The Chechen authorities’ response to the global outrage over the pogrom has provoked new incredulity. In a telephone interview, Mr. Kadyrov’s spokesman, Alvi Karimov, said the reports of an anti-gay pogrom had to be false because such men did not exist in Chechnya. “In Grozny, have you ever noticed people who, by their appearance or manners, resemble people who are oriented in the wrong way?” Mr. Karimov asked. “A policy is developed for a problem,” he said, referring to a report that said the arrests were official policy. “I can officially say there is no policy because there is no problem. If there were a problem, there would be a policy.” In a televised meeting with President Vladimir V. Putin of Russia on Wednesday, Mr. Kadyrov characterized as “libelous” news reports that the security services in Chechnya had been persecuting gay men. And on Thursday, Mr. Putin’s spokesman, Dmitri S. Peskov, told journalists that the Russian authorities had found no evidence that the Chechen police had arrested gay men. But it quickly became clear to Maksim and the other men that the Chechen authorities were applying the same tactics used by Russia and by Mr. Kadyrov to suppress an Islamist insurgency in the region over the past decade. Security service agents took to posing as gay men looking for dates on the Village and in other chat rooms, or persuaded those they had already captured to lure acquaintances, those arrested said in interviews. Fear spread among gay Chechens. “If they caught him, they will get to me,” said a 20-year-old student who identified himself as Ilya and who was interviewed at a safe location outside Chechnya. Ilya fled days before the police showed up at his home, he learned later. The authorities briefly detained another young man, who identified himself as Nohcho, after a friend informed on him during an interrogation. “I don’t blame him,” Nohcho said of the friend. “We are not heroes. We’re just gay guys. They starve you. They shock you.” That, it seems, is essentially what happened to Maksim, who had been corresponding with his gay acquaintance for some time. “One day, he suggested we meet for a drink,” Maksim said. “And because we knew each other a long time, I did not suspect he would be capable of something like this.” When Maksim entered the apartment where they had agreed to meet, security officers roughed him up. Five other men were already in the apartment, lured by the same ruse, he said. His account of the deception used to detain him was consistent with others documented by Human Rights Watch and with the accounts of the two other gay men interviewed separately for this article. All six of the men in the apartment were transferred to a makeshift cell in an abandoned building, where they were tortured with electricity one by one, Maksim said. After 11 days, he was released to a male relative, who was told that Maksim was gay. The security officers told the captives’ male relatives that, if they had any honor, they would kill the young men, Maksim and Ilya said. Maksim’s father threatened to beat him but refrained when his son showed him the bruises he already had. Instead his father said, “I should kill you.” Fearing for his life, Maksim turned to a gay rights group, the Russian LGBT Network, based in St. Petersburg, which has established an emergency, round-the-clock volunteer group to help gay men escape the region. To reassure the victims they are trying to help, the activists have taken extraordinary precautions, operating virtually as a partisan cell behind enemy lines, though they have done nothing illegal under Russian law. “These people don’t trust anybody,” said Olga Baranova, director of the Moscow Community Center, a support group for gays that is part of the volunteer network helping gay men flee Chechnya. After arriving at the safe location outside Chechnya, several young men said they had suspected that the volunteer group was also a trap but had no other option but to accept the help, Ms. Baranova said. “They say, ‘We didn’t believe you were real,’” she said. “‘We thought this was the last effort to round up whoever was left.’” The network bought airplane tickets for Chechen gay men, found safe houses and arranged for doctors to treat those who had been badly beaten. “Gays in Chechnya and the North Caucasus are in lethal danger,” Igor Kochetkov, director of the Russian LGBT Network, said in a telephone interview. “People whose partners are detained have every reason to believe they will be arrested. It is very hard not to name the names under torture.” ",New York Times,1
https://www.nytimes.com/2017/04/17/opinion/when-hate-leads-to-depression.html,"This Week in Hate highlights hate crimes and harassment around the country since the election of President Trump. Women afraid to go out in public. College students struggling in school. Employees feeling unsafe on the job. People of all walks of life experiencing anxiety, depression and post-traumatic stress disorder. These are some of the mental and emotional effects of what advocates say is a wave of hate crimes and racist harassment that started during President Trump’s campaign. Muslims, immigrants and members of other groups targeted with violence and intimidation are seeking help to deal with lingering trauma. But mental health groups and advocates are finding that the specialized support they need doesn’t always exist. The Family and Youth Institute, which studies the mental health needs of American Muslims, has seen more reports of anxiety and depression since the campaign began, as well as more people seeking therapy and asking questions about mental health. It’s not only victims of hate crimes who are affected, according to Dr. Sameera Ahmed, the director of the institute — anti-Muslim harassment and political rhetoric are having a psychological impact on many American Muslims, regardless of whether they have been personally targeted. Muslims in America have been in “perpetual crisis mode” in recent years, dealing with the aftermath of the 2015 Paris attacks, followed by President Trump’s campaign, election, inauguration and travel ban, said Dr. Rania Awaad, the director of the Muslims and Mental Health Lab at Stanford University and the clinical director of the San Francisco Bay Area branch of the Khalil Center, a Muslim counseling center. In November, the center offered a support group for young people, some of whom had been harassed at school, but their parents wouldn’t leave — they wanted help too. Eventually, “they went to a corner of the conference room and created their own little support group,” Dr. Awaad said. Not everyone can find support in the wake of a hate crime. Dr. Prabhjot Singh, now the chair of the department of health system design and global health at the Mount Sinai Health System, felt angry and depressed after he was attacked in New York in 2005, when he was in graduate school. He reached out to mental health services at his university, but they weren’t much help, since they were geared toward people with severe psychiatric illness. When he was attacked again a few years later, his anger, depression and sense of isolation deepened. He dealt with them by throwing himself into work. He also began practicing his Sikh religion more actively, growing his beard and waking up before dawn to meditate. Then, in 2013, he was attacked by a group of young men who called him “Osama” and “terrorist” and punched him in the face, breaking his jaw. That attack got significant media attention, and people began to email him asking for advice after they or their loved ones experienced hate crimes. The volume of recent messages has been a sign for him that hate crimes are on the rise. “I just hear it in my inbox,” he said. Sometimes Dr. Singh can help the people who write to him, and sometimes he can’t. He sees a lack of resources for people who have been victims of hate crimes: “I don’t think there’s really a good way for people who have had this type of experience to find useful community.” Some nonprofit groups are mobilizing to offer mental health services for people affected by hate crimes or harassment, who may have unique needs that conventional therapy doesn’t always address. Staff at the YWCA of Kalamazoo in western Michigan found that while people who had experienced hate crimes could find individual counseling in the area, which is home to many immigrants working in the agriculture industry, there were no services for people feeling the indirect effects of hate crimes against people of their race or religion, said Jessica Glynn, the director of law and policy at the YWCA. To fill the gap, the YWCA of Kalamazoo earlier this year created a support group for survivors, witnesses and others affected by hate crimes, and plans to create more groups in the area if needed. Established a year and a half ago, the Bay Area Khalil Center has already expanded to include a second branch, and a third is in the works. In addition to support groups, the center offers individual therapy with Muslim therapists. Working with a therapist who shares their religion means patients “don’t have to start from scratch explaining things,” said Dr. Awaad. The Maryland chapter of the Council on American-Islamic Relations holds free self-defense workshops and recently conducted its first training on how to respond to an active shooter. Learning preparedness skills can help people cope with anxiety and fear, said Dr. Zainab Chaudry, the council’s Maryland outreach manager. “We can’t control external factors in our environment,” she added, “but we can control how we respond.” Since the attack in 2013, Dr. Singh has discovered that little research or advice exists to help doctors identify and treat patients who have experienced hate crimes. He’s begun work on a guide, perhaps drawing on techniques developed to treat survivors of domestic and sexual violence. Dr. Singh saw the election of President Trump as the latest symptom of a deep national confusion that he’s not sure how to address. But he takes comfort in his Sikh practice: “finding that stillness, finding that discipline to remember that we know each other far more than we say we do. We are all connected.” If you have experienced, witnessed or read about a hate crime or incident of bias or harassment, you can use this form to send information about the incident to This Week in Hate and other partners in the Documenting Hate project. The form is not a report to law enforcement or any government agency. These resources may be helpful for people who have experienced harassment. If you witness harassment, here are some tips for responding. You can contact This Week in Hate at weekinhate@nytimes.com. ",New York Times,1
https://www.nytimes.com/2017/04/13/world/europe/un-chechnya-gay-men-killing-abuse.html,"LONDON — United Nations experts demanded on Thursday that Chechnya halt the abduction, detention, beating and killing of gay and bisexual men, after weeks of reports about violent repression there. “These are acts of persecution and violence on an unprecedented scale in the region and constitute serious violations of the obligations of the Russian Federation under international human rights law,” the experts, a panel of five that advises the United Nations Human Rights Council, said in a statement. The experts noted that much of the abuse was reported to have taken place at an unofficial detention center near Argun, a town about 10 miles east of Grozny, the Chechen capital. “The arrested men are subjected to physical and verbal abuse, torture including with electric shocks, beatings, insults and humiliations,” the experts wrote. “They are forced to give contact details of other gay people and threatened with having their sexual orientation disclosed to their family and community — a move which could put them at risk of ‘honor killings.’” Since last month, reports have circulated within Russia that local militias and security forces have been hunting down, detaining and abusing men they perceived to be gay or bisexual. On April 1, a leading opposition newspaper, Novaya Gazeta, confirmed those reports, citing Russian federal law enforcement officials, who blamed the local authorities. Dozens of men are said to have been rounded up, but precise numbers — including a death toll — are not available. Since 2007, Chechnya — a mountainous republic within the Russian Federation and the site of a long-running insurgency that Russia eventually crushed — has been led by a strongman, Ramzan A. Kadyrov, who has been granted significant leeway in exchange for his allegiance to the Kremlin. In restive Muslim regions in southern Russia, Mr. Putin has empowered local leaders to enforce their interpretation of traditional Muslim values, partly in an effort to co-opt Islamist extremism, which has largely been driven underground. A spokesman for Mr. Kadyrov issued a chilling denial on April 1, after the initial reports surfaced. “You cannot arrest or repress people who just don’t exist in the republic,” the spokesman, Alvi Karimov, told the Interfax news agency. “If such people existed in Chechnya, law enforcement would not have to worry about them, as their own relatives would have sent them to where they could never return.” The Kremlin’s spokesman, Dmitri S. Peskov, said on April 3 that he could not confirm the newspaper’s account but added: “This is something for law enforcement to deal with. This is not on the Kremlin’s agenda.” According to Novaya Gazeta, the persecution intensified after a group based in Moscow, GayRussia.ru, applied for permits to stage gay-pride parades in four cities in the North Caucasus region. The group did not apply for a permit in Chechnya, but it did in another Muslim area in the region, Kabardino-Balkaria. The mere application there — denied, as usual — prompted an anti-gay counterdemonstration. “In Chechnya, the command was given for a ‘prophylactic sweep,’ and it went as far as real murders,” Novaya Gazeta reported. As part of the sweep, investigators posed as men looking for dates or sex. Gay men have begun deleting online accounts or even fleeing the region, the newspaper reported. The United Nations experts urged the authorities to end the persecution, saying that Chechens were “living in a climate of fear fueled by homophobic speeches by local authorities.” They also demanded that the authorities immediately release all detainees, thoroughly investigate the anti-gay campaign and hold the persecutors accountable. The experts condemned statements by Chechen officials suggesting that gay people should be hunted down and killed. “The Russian Federation must officially state that it does not tolerate any form of incitement to violence, social stigmatization of homosexuality or hate speech, and does not condone discrimination or violence against people based on their sexual orientation or gender identity,” their statement said. There was little suggestion that Moscow would give the experts’ warnings much heed. Russia has been widely criticized for cracking down on the rights of gay, lesbian, bisexual and transgender people. In 2013, a law criminalized giving minors materials promoting “nontraditional” sexual relationships — a statute that has been used to justify the arrests of gay rights activists. The experts are Vitit Muntarbhorn of Thailand, who focuses on sexual orientation and gender identity; Sètondji Roland Adjovi of Benin, an expert on arbitrary detention; Agnès Callamard of France, an authority on extrajudicial, summary or arbitrary executions; Nils Melzer of Switzerland, who focuses on torture and other cruel, inhumane and degrading treatment or punishment; and David Kaye of the United States, a specialist in freedom of opinion and expression. ",New York Times,1
